{"schema_version":"archy-revision-v1","revision":1,"previous_sha256":null,"idempotency_key":"historical-marker-generate-7728da0","request_sha256":"9b77d52a4e0876ad0d6e2438b6d6491fb3ad309defb3e5422233b165d9dcf547","request_schema_version":"archy-run-request-v1","receipt":{"run_id":"e80391ef-a7ec-4900-8d05-9409b250094e","revision":1,"manifest_sha256":"465afef8ac4548bc3d0bc187b69815fd90bddfe9c66aa1dd62677aeaa6c16970","path":"runs/e80391ef-a7ec-4900-8d05-9409b250094e"}}