{"schema_version":"archy-revision-v1","revision":2,"previous_sha256":"e67818ccc582f9f8fa2472686e4fa2f50c0882889009a1f26d62803c9c90500b","idempotency_key":"29b1217c-e82c-4327-879e-f83d6bee9d77","request_sha256":"78994e1b7c6fdc09a24ffcdf37ad5fb72c4d6c10510467a19e45e81f965ddb36","request_schema_version":"archy-run-request-v1","receipt":{"run_id":"8c9dfb50-2d67-4cd0-b667-0bc128a2cb3d","revision":2,"manifest_sha256":"f7cb83914ab86d32c9bc0d6c3282483b8bdd8028bab9196f711ab320930a37da","path":"runs/8c9dfb50-2d67-4cd0-b667-0bc128a2cb3d"}}