{"schema_version":"archy-revision-v1","revision":3,"previous_sha256":"d0254ca27b78419fd7160d8fef39d9a4dfc632c7e99635f03df6c7d50749f94d","idempotency_key":"864af60d-4c7e-4785-8100-58c6246b0977","request_sha256":"4249a89cc8cb08744f3015aff25b1f456892a3baae82ca01298f4e5ad0e180d8","request_schema_version":"archy-run-request-v1","receipt":{"run_id":"71f3dfdc-b88c-4d9d-9027-411efa54d380","revision":3,"manifest_sha256":"3f0be4ee2d433e3ab6da3cdca39a6c49387ff2528e5bed666c670e25b0dcf399","path":"runs/71f3dfdc-b88c-4d9d-9027-411efa54d380"}}