{"schema_version":"archy-revision-v1","revision":5,"previous_sha256":"1ccd508680dada2241d0bb0b81da71fbef869be8e8c5722405d871b0556a3f9e","idempotency_key":"5fcfb9da-8486-49b0-83da-a626ec1759af","request_sha256":"fd6bbb1b4fbac15f9b3117002930fab6ae621e4d74139925db9eb697a86ee6dc","request_schema_version":"archy-run-request-v1","receipt":{"run_id":"860e2341-e139-44b1-a49d-2a5e2ceedd23","revision":5,"manifest_sha256":"4629cb801fefe8d8796db91e95fcedfeb0454712b5011f576cac603ef586f93d","path":"runs/860e2341-e139-44b1-a49d-2a5e2ceedd23"}}