{"schema_version":"archy-revision-v1","revision":4,"previous_sha256":"71efe5fe208489f9cf1971c5e1ac57345ded7785fa195e24311a78a0b68b4a52","idempotency_key":"a9c15b50-a0d6-4262-a9cd-b30abf9abf5d","request_sha256":"8be16cdecdbdf0fea32394d01ed49defde0131937dd9a54fa875af5df6649d8a","request_schema_version":"archy-run-request-v1","receipt":{"run_id":"62040078-5b31-46af-95f6-07205fdac442","revision":4,"manifest_sha256":"d73847cb29564dfcdf036144606a0a7aa5153a08c8857e74e8ec90470b6238b2","path":"runs/62040078-5b31-46af-95f6-07205fdac442"}}