{"schema_version":"archy-revision-v1","revision":1,"previous_sha256":null,"idempotency_key":"legacy-pref-key","request_sha256":"00ca1ca627741db58a5ecdf8ee0836c2552c3e34ba81cfb610dc5f83ef7ee482","request_schema_version":"archy-run-request-v1","receipt":{"run_id":"5248af90-8dfe-4743-b056-7d3385c62c97","revision":1,"manifest_sha256":"d0a094437119d04cb52e8f45b83ab5c0e92d4daf21b4bbfc5d0e2100c0794260","path":"runs/5248af90-8dfe-4743-b056-7d3385c62c97"}}