{"schema_version":"archy-revision-v1","revision":1,"previous_sha256":null,"idempotency_key":"75a6a77a-3532-4d91-8fea-139afe34323a","request_sha256":"5f6de957f0fa89832843ac6f579f2057d30f43e2ca33214310c0edf9fefaf64d","request_schema_version":"archy-run-request-v1","receipt":{"run_id":"c434a0b2-f7ea-47bb-9af1-fdfda414d906","revision":1,"manifest_sha256":"b945859be1c61361ebeb641daeabcaf2db7b28a91f574548f31a60927a8c24c5","path":"runs/c434a0b2-f7ea-47bb-9af1-fdfda414d906"}}