{"schema_version":"archy-revision-v1","revision":2,"previous_sha256":"71ea01c7650072a00b5d260ada02479d250f8234114981f4dcebe090164a752b","idempotency_key":"historical-marker-evaluate-7728da0","request_sha256":"9614c4a133d6bbef3046c9060874b894dacd7f6ab0d5c595302af4657ec549b7","request_schema_version":"archy-run-request-v1","receipt":{"run_id":"a112afe0-ab7b-414d-8f35-11d5f97814c9","revision":2,"manifest_sha256":"cf80a90b27de1319efa4dadf7a4a00d3b0650b745544fe7d0c5c5129300a414b","path":"runs/a112afe0-ab7b-414d-8f35-11d5f97814c9"}}